{
  "schema_version": "divisions_v0.1",
  "book_id": "wasitiyyah",
  "source_html_sha256": "6cef9c1e05eaa7e5f69327289e6d6d316cb7749a140324978c1da092f2a03fe9",
  "pages_jsonl_sha256": "babafa08deaf84ec1a0bdb8fe00cf992ca7f38e79f584229b6dd8635488689d6",
  "generator_tool": "tools/discover_structure.py",
  "generator_version": "v0.3",
  "generated_utc": "2026-02-28T20:17:37.779366+00:00",
  "total_pages": 32,
  "total_divisions": 15,
  "toc_detected": false,
  "structure_confidence": "high",
  "divisions": [
    {
      "id": "div_0000",
      "type": "مقدمة",
      "title": "مقدمة المؤلف",
      "level": 1,
      "detection_method": "html_tagged",
      "confidence": "confirmed",
      "digestible": "true",
      "content_type": "teaching",
      "start_seq_index": 1,
      "end_seq_index": 9,
      "page_hint_start": "ص:٢",
      "page_hint_end": "ص:١٠",
      "parent_id": null,
      "child_ids": [],
      "page_count": 9,
      "ordinal": null,
      "editor_inserted": false,
      "heading_in_html": true,
      "inline_heading": false,
      "heading_text_boundary": null,
      "review_flags": [],
      "detection_notes": null,
      "human_override": null
    },
    {
      "id": "div_0001",
      "type": "implicit",
      "title": "الإيمان بما وصف الله به نفسه في كتابه",
      "level": 1,
      "detection_method": "html_tagged",
      "confidence": "confirmed",
      "digestible": "true",
      "content_type": "teaching",
      "start_seq_index": 1,
      "end_seq_index": 1,
      "page_hint_start": "ص:٢",
      "page_hint_end": "ص:٢",
      "parent_id": null,
      "child_ids": [],
      "page_count": 1,
      "ordinal": null,
      "editor_inserted": false,
      "heading_in_html": true,
      "inline_heading": false,
      "heading_text_boundary": null,
      "review_flags": [
        "same_page_cluster"
      ],
      "detection_notes": null,
      "human_override": null
    },
    {
      "id": "div_0002",
      "type": "implicit",
      "title": "الإيمان بما وصف الرسول صلى الله عليه وسلم به ربه",
      "level": 1,
      "detection_method": "html_tagged",
      "confidence": "confirmed",
      "digestible": "true",
      "content_type": "teaching",
      "start_seq_index": 10,
      "end_seq_index": 15,
      "page_hint_start": "ص:١١",
      "page_hint_end": "ص:١٦",
      "parent_id": null,
      "child_ids": [],
      "page_count": 6,
      "ordinal": null,
      "editor_inserted": false,
      "heading_in_html": true,
      "inline_heading": false,
      "heading_text_boundary": null,
      "review_flags": [],
      "detection_notes": null,
      "human_override": null
    },
    {
      "id": "div_0003",
      "type": "implicit",
      "title": "الإيمان بأنه فوق عرشه",
      "level": 1,
      "detection_method": "html_tagged",
      "confidence": "confirmed",
      "digestible": "true",
      "content_type": "teaching",
      "start_seq_index": 16,
      "end_seq_index": 16,
      "page_hint_start": "ص:١٧",
      "page_hint_end": "ص:١٧",
      "parent_id": null,
      "child_ids": [],
      "page_count": 1,
      "ordinal": null,
      "editor_inserted": false,
      "heading_in_html": true,
      "inline_heading": false,
      "heading_text_boundary": null,
      "review_flags": [],
      "detection_notes": null,
      "human_override": null
    },
    {
      "id": "div_0004",
      "type": "implicit",
      "title": "الإيمان بأنه قريب مجيب",
      "level": 1,
      "detection_method": "html_tagged",
      "confidence": "confirmed",
      "digestible": "true",
      "content_type": "teaching",
      "start_seq_index": 16,
      "end_seq_index": 16,
      "page_hint_start": "ص:١٧",
      "page_hint_end": "ص:١٧",
      "parent_id": null,
      "child_ids": [],
      "page_count": 1,
      "ordinal": null,
      "editor_inserted": false,
      "heading_in_html": true,
      "inline_heading": false,
      "heading_text_boundary": null,
      "review_flags": [
        "same_page_cluster"
      ],
      "detection_notes": null,
      "human_override": null
    },
    {
      "id": "div_0005",
      "type": "implicit",
      "title": "الإيمان بأن القرآن كلام الله منزل غير مخلوق",
      "level": 1,
      "detection_method": "html_tagged",
      "confidence": "confirmed",
      "digestible": "true",
      "content_type": "teaching",
      "start_seq_index": 17,
      "end_seq_index": 17,
      "page_hint_start": "ص:١٨",
      "page_hint_end": "ص:١٨",
      "parent_id": null,
      "child_ids": [],
      "page_count": 1,
      "ordinal": null,
      "editor_inserted": false,
      "heading_in_html": true,
      "inline_heading": false,
      "heading_text_boundary": null,
      "review_flags": [],
      "detection_notes": null,
      "human_override": null
    },
    {
      "id": "div_0006",
      "type": "implicit",
      "title": "الإيمان برؤية المؤمنين لربهم",
      "level": 1,
      "detection_method": "html_tagged",
      "confidence": "confirmed",
      "digestible": "true",
      "content_type": "teaching",
      "start_seq_index": 17,
      "end_seq_index": 17,
      "page_hint_start": "ص:١٨",
      "page_hint_end": "ص:١٨",
      "parent_id": null,
      "child_ids": [],
      "page_count": 1,
      "ordinal": null,
      "editor_inserted": false,
      "heading_in_html": true,
      "inline_heading": false,
      "heading_text_boundary": null,
      "review_flags": [
        "same_page_cluster"
      ],
      "detection_notes": null,
      "human_override": null
    },
    {
      "id": "div_0007",
      "type": "implicit",
      "title": "الإيمان بما بعد الموت",
      "level": 1,
      "detection_method": "html_tagged",
      "confidence": "confirmed",
      "digestible": "true",
      "content_type": "teaching",
      "start_seq_index": 18,
      "end_seq_index": 19,
      "page_hint_start": "ص:١٩",
      "page_hint_end": "ص:٢٠",
      "parent_id": null,
      "child_ids": [],
      "page_count": 2,
      "ordinal": null,
      "editor_inserted": false,
      "heading_in_html": true,
      "inline_heading": false,
      "heading_text_boundary": null,
      "review_flags": [],
      "detection_notes": null,
      "human_override": null
    },
    {
      "id": "div_0008",
      "type": "implicit",
      "title": "الإيمان بالقدر خيره وشره",
      "level": 1,
      "detection_method": "html_tagged",
      "confidence": "confirmed",
      "digestible": "true",
      "content_type": "teaching",
      "start_seq_index": 20,
      "end_seq_index": 21,
      "page_hint_start": "ص:٢١",
      "page_hint_end": "ص:٢٢",
      "parent_id": null,
      "child_ids": [],
      "page_count": 2,
      "ordinal": null,
      "editor_inserted": false,
      "heading_in_html": true,
      "inline_heading": false,
      "heading_text_boundary": null,
      "review_flags": [],
      "detection_notes": null,
      "human_override": null
    },
    {
      "id": "div_0009",
      "type": "implicit",
      "title": "الإيمان قول وعمل يزيد وينقص",
      "level": 1,
      "detection_method": "html_tagged",
      "confidence": "confirmed",
      "digestible": "true",
      "content_type": "teaching",
      "start_seq_index": 22,
      "end_seq_index": 22,
      "page_hint_start": "ص:٢٣",
      "page_hint_end": "ص:٢٣",
      "parent_id": null,
      "child_ids": [],
      "page_count": 1,
      "ordinal": null,
      "editor_inserted": false,
      "heading_in_html": true,
      "inline_heading": false,
      "heading_text_boundary": null,
      "review_flags": [],
      "detection_notes": null,
      "human_override": null
    },
    {
      "id": "div_0010",
      "type": "implicit",
      "title": "وجوب حب الصحابة وأهل البيت",
      "level": 1,
      "detection_method": "html_tagged",
      "confidence": "confirmed",
      "digestible": "true",
      "content_type": "teaching",
      "start_seq_index": 23,
      "end_seq_index": 25,
      "page_hint_start": "ص:٢٤",
      "page_hint_end": "ص:٢٦",
      "parent_id": null,
      "child_ids": [],
      "page_count": 3,
      "ordinal": null,
      "editor_inserted": false,
      "heading_in_html": true,
      "inline_heading": false,
      "heading_text_boundary": null,
      "review_flags": [],
      "detection_notes": null,
      "human_override": null
    },
    {
      "id": "div_0011",
      "type": "implicit",
      "title": "وجوب التصديق بكرامات الأولياء",
      "level": 1,
      "detection_method": "html_tagged",
      "confidence": "confirmed",
      "digestible": "true",
      "content_type": "teaching",
      "start_seq_index": 26,
      "end_seq_index": 26,
      "page_hint_start": "ص:٢٧",
      "page_hint_end": "ص:٢٧",
      "parent_id": null,
      "child_ids": [],
      "page_count": 1,
      "ordinal": null,
      "editor_inserted": false,
      "heading_in_html": true,
      "inline_heading": false,
      "heading_text_boundary": null,
      "review_flags": [],
      "detection_notes": null,
      "human_override": null
    },
    {
      "id": "div_0012",
      "type": "implicit",
      "title": "من علامات أهل السنة الإتباع وليس الابتداع",
      "level": 1,
      "detection_method": "html_tagged",
      "confidence": "confirmed",
      "digestible": "true",
      "content_type": "teaching",
      "start_seq_index": 27,
      "end_seq_index": 27,
      "page_hint_start": "ص:٢٨",
      "page_hint_end": "ص:٢٨",
      "parent_id": null,
      "child_ids": [],
      "page_count": 1,
      "ordinal": null,
      "editor_inserted": false,
      "heading_in_html": true,
      "inline_heading": false,
      "heading_text_boundary": null,
      "review_flags": [],
      "detection_notes": null,
      "human_override": null
    },
    {
      "id": "div_0013",
      "type": "implicit",
      "title": "متفرقات والخاتمة",
      "level": 1,
      "detection_method": "html_tagged",
      "confidence": "confirmed",
      "digestible": "true",
      "content_type": "teaching",
      "start_seq_index": 28,
      "end_seq_index": 29,
      "page_hint_start": "ص:٢٩",